{"$schema":"https://json-schema.org/draft/2020-12/schema","title":"Graph metrics","type":"object","additionalProperties":false,"required":["schema_version","status","source_of_truth","summary","node_metrics","path_metrics"],"properties":{"schema_version":{"type":"string"},"status":{"enum":["draft","stable"]},"source_of_truth":{"type":"array","minItems":1,"uniqueItems":true,"items":{"type":"string","minLength":1}},"summary":{"type":"object","additionalProperties":false,"required":["node_count","relationship_count","relationship_types","cross_domain_relationships","connected_node_count","isolated_node_ids","average_incident_relationships"],"properties":{"node_count":{"type":"integer","minimum":0},"relationship_count":{"type":"integer","minimum":0},"relationship_types":{"type":"object","additionalProperties":false,"required":["requires","supports","related_to"],"properties":{"requires":{"type":"integer","minimum":0},"supports":{"type":"integer","minimum":0},"related_to":{"type":"integer","minimum":0}}},"cross_domain_relationships":{"type":"integer","minimum":0},"connected_node_count":{"type":"integer","minimum":0},"isolated_node_ids":{"type":"array","uniqueItems":true,"items":{"type":"string"}},"average_incident_relationships":{"type":"number","minimum":0}}},"node_metrics":{"type":"array","items":{"type":"object","additionalProperties":false,"required":["competency_id","incoming_directed","outgoing_directed","undirected_related","total_incident"],"properties":{"competency_id":{"type":"string","pattern":"^(AI|BIZ|PRO|SOC)-[A-Z]{3}-[0-9]{3}$"},"incoming_directed":{"type":"integer","minimum":0},"outgoing_directed":{"type":"integer","minimum":0},"undirected_related":{"type":"integer","minimum":0},"total_incident":{"type":"integer","minimum":0}}}},"path_metrics":{"type":"array","items":{"type":"object","additionalProperties":false,"required":["path_id","step_count","domains_covered","cross_domain_transitions"],"properties":{"path_id":{"type":"string","pattern":"^PATH-[0-9]{3}$"},"step_count":{"type":"integer","minimum":2},"domains_covered":{"type":"array","minItems":1,"uniqueItems":true,"items":{"enum":["AI","BIZ","PRO","SOC"]}},"cross_domain_transitions":{"type":"integer","minimum":0}}}}}}
